{"schemaVersion":1,"id":"4dd72e88-ce6a-4308-8c5e-fc616301190a","projectId":"dbb67017c1f3c6584651806533eb4153efba6043b155ca8c5b3ec865e0164bbe","createdAt":1792501944907,"operation":"SCAN","scopeId":"4beddff7f12af7cca589dbfb2f6718ae361135898fc571875cb48243f86fcbbd","scopeKnown":true,"complete":true,"stale":false,"truncated":false,"verdict":"CLEAN","providers":[{"id":"wrapperguard","version":"0.6.0","status":"COMPLETED"},{"id":"company.demo-review","version":"1.0.0","status":"DISABLED"}],"findings":[{"fingerprint":"36b8a63a68bb995f17e49b63","providerId":"wrapperguard","ruleId":"WG-STRUCT-003","title":"No Gradle settings file found","severity":"INFO","status":"ACTIVE","path":"backend"}]}